[
  {
    "is_synthetic": true,
    "id": "VISIT-0007",
    "ticket_id": "WO-0007",
    "site_id": "SITE-157",
    "status": "pending_customer_confirmation",
    "proposed_start": "2026-10-27T08:00:00Z",
    "timezone": "Europe/Paris",
    "technician_id": "USR-039",
    "approved_by": null,
    "notice": "未来预约提案，不是已发生事件，也不是已确认服务承诺。"
  },
  {
    "is_synthetic": true,
    "id": "VISIT-0016",
    "ticket_id": "WO-0016",
    "site_id": "SITE-158",
    "status": "pending_customer_confirmation",
    "proposed_start": "2026-10-27T08:00:00Z",
    "timezone": "Europe/Paris",
    "technician_id": "USR-037",
    "approved_by": null,
    "notice": "未来预约提案，不是已发生事件，也不是已确认服务承诺。"
  },
  {
    "is_synthetic": true,
    "id": "VISIT-0025",
    "ticket_id": "WO-0025",
    "site_id": "SITE-157",
    "status": "pending_customer_confirmation",
    "proposed_start": "2026-10-27T08:00:00Z",
    "timezone": "Europe/Paris",
    "technician_id": "USR-037",
    "approved_by": null,
    "notice": "未来预约提案，不是已发生事件，也不是已确认服务承诺。"
  },
  {
    "is_synthetic": true,
    "id": "VISIT-0034",
    "ticket_id": "WO-0034",
    "site_id": "SITE-158",
    "status": "pending_customer_confirmation",
    "proposed_start": "2026-10-27T08:00:00Z",
    "timezone": "Europe/Paris",
    "technician_id": "USR-039",
    "approved_by": null,
    "notice": "未来预约提案，不是已发生事件，也不是已确认服务承诺。"
  },
  {
    "is_synthetic": true,
    "id": "VISIT-0043",
    "ticket_id": "WO-0043",
    "site_id": "SITE-157",
    "status": "pending_customer_confirmation",
    "proposed_start": "2026-10-27T08:00:00Z",
    "timezone": "Europe/Paris",
    "technician_id": "USR-037",
    "approved_by": null,
    "notice": "未来预约提案，不是已发生事件，也不是已确认服务承诺。"
  },
  {
    "is_synthetic": true,
    "id": "VISIT-0052",
    "ticket_id": "WO-0052",
    "site_id": "SITE-158",
    "status": "pending_customer_confirmation",
    "proposed_start": "2026-10-27T08:00:00Z",
    "timezone": "Europe/Paris",
    "technician_id": "USR-037",
    "approved_by": null,
    "notice": "未来预约提案，不是已发生事件，也不是已确认服务承诺。"
  },
  {
    "is_synthetic": true,
    "id": "VISIT-0061",
    "ticket_id": "WO-0061",
    "site_id": "SITE-157",
    "status": "pending_customer_confirmation",
    "proposed_start": "2026-10-27T08:00:00Z",
    "timezone": "Europe/Paris",
    "technician_id": "USR-037",
    "approved_by": null,
    "notice": "未来预约提案，不是已发生事件，也不是已确认服务承诺。"
  },
  {
    "is_synthetic": true,
    "id": "VISIT-0079",
    "ticket_id": "WO-0079",
    "site_id": "SITE-181",
    "status": "pending_customer_confirmation",
    "proposed_start": "2026-10-27T08:00:00Z",
    "timezone": "Europe/Rome",
    "technician_id": "USR-043",
    "approved_by": null,
    "notice": "未来预约提案，不是已发生事件，也不是已确认服务承诺。"
  },
  {
    "is_synthetic": true,
    "id": "VISIT-0088",
    "ticket_id": "WO-0088",
    "site_id": "SITE-178",
    "status": "pending_customer_confirmation",
    "proposed_start": "2026-10-27T08:00:00Z",
    "timezone": "Europe/Rome",
    "technician_id": "USR-045",
    "approved_by": null,
    "notice": "未来预约提案，不是已发生事件，也不是已确认服务承诺。"
  },
  {
    "is_synthetic": true,
    "id": "VISIT-0107",
    "ticket_id": "WO-0107",
    "site_id": "SITE-017",
    "status": "pending_customer_confirmation",
    "proposed_start": "2026-10-27T08:00:00Z",
    "timezone": "Europe/Berlin",
    "technician_id": "USR-001",
    "approved_by": null,
    "notice": "未来预约提案，不是已发生事件，也不是已确认服务承诺。"
  },
  {
    "is_synthetic": true,
    "id": "VISIT-0115",
    "ticket_id": "WO-0115",
    "site_id": "SITE-179",
    "status": "pending_customer_confirmation",
    "proposed_start": "2026-10-27T08:00:00Z",
    "timezone": "Europe/Rome",
    "technician_id": "USR-043",
    "approved_by": null,
    "notice": "未来预约提案，不是已发生事件，也不是已确认服务承诺。"
  },
  {
    "is_synthetic": true,
    "id": "VISIT-0125",
    "ticket_id": "WO-0125",
    "site_id": "SITE-021",
    "status": "pending_customer_confirmation",
    "proposed_start": "2026-10-27T08:00:00Z",
    "timezone": "Europe/Berlin",
    "technician_id": "USR-001",
    "approved_by": null,
    "notice": "未来预约提案，不是已发生事件，也不是已确认服务承诺。"
  },
  {
    "is_synthetic": true,
    "id": "VISIT-0152",
    "ticket_id": "WO-0152",
    "site_id": "SITE-014",
    "status": "pending_customer_confirmation",
    "proposed_start": "2026-10-27T08:00:00Z",
    "timezone": "Europe/Berlin",
    "technician_id": "USR-001",
    "approved_by": null,
    "notice": "未来预约提案，不是已发生事件，也不是已确认服务承诺。"
  },
  {
    "is_synthetic": true,
    "id": "VISIT-0334",
    "ticket_id": "WO-0334",
    "site_id": "SITE-110",
    "status": "pending_customer_confirmation",
    "proposed_start": "2026-10-27T08:00:00Z",
    "timezone": "Australia/Sydney",
    "technician_id": "USR-025",
    "approved_by": null,
    "notice": "未来预约提案，不是已发生事件，也不是已确认服务承诺。"
  },
  {
    "is_synthetic": true,
    "id": "VISIT-0349",
    "ticket_id": "WO-0349",
    "site_id": "SITE-067",
    "status": "pending_customer_confirmation",
    "proposed_start": "2026-10-27T08:00:00Z",
    "timezone": "Europe/Madrid",
    "technician_id": "USR-015",
    "approved_by": null,
    "notice": "未来预约提案，不是已发生事件，也不是已确认服务承诺。"
  },
  {
    "is_synthetic": true,
    "id": "VISIT-0352",
    "ticket_id": "WO-0352",
    "site_id": "SITE-110",
    "status": "pending_customer_confirmation",
    "proposed_start": "2026-10-27T08:00:00Z",
    "timezone": "Australia/Sydney",
    "technician_id": "USR-025",
    "approved_by": null,
    "notice": "未来预约提案，不是已发生事件，也不是已确认服务承诺。"
  },
  {
    "is_synthetic": true,
    "id": "VISIT-0367",
    "ticket_id": "WO-0367",
    "site_id": "SITE-053",
    "status": "pending_customer_confirmation",
    "proposed_start": "2026-10-27T08:00:00Z",
    "timezone": "Europe/Madrid",
    "technician_id": "USR-015",
    "approved_by": null,
    "notice": "未来预约提案，不是已发生事件，也不是已确认服务承诺。"
  },
  {
    "is_synthetic": true,
    "id": "VISIT-0380",
    "ticket_id": "WO-0380",
    "site_id": "SITE-158",
    "status": "pending_customer_confirmation",
    "proposed_start": "2026-10-27T08:00:00Z",
    "timezone": "Europe/Paris",
    "technician_id": "USR-037",
    "approved_by": null,
    "notice": "未来预约提案，不是已发生事件，也不是已确认服务承诺。"
  },
  {
    "is_synthetic": true,
    "id": "VISIT-0389",
    "ticket_id": "WO-0389",
    "site_id": "SITE-157",
    "status": "pending_customer_confirmation",
    "proposed_start": "2026-10-27T08:00:00Z",
    "timezone": "Europe/Paris",
    "technician_id": "USR-037",
    "approved_by": null,
    "notice": "未来预约提案，不是已发生事件，也不是已确认服务承诺。"
  },
  {
    "is_synthetic": true,
    "id": "VISIT-0398",
    "ticket_id": "WO-0398",
    "site_id": "SITE-162",
    "status": "pending_customer_confirmation",
    "proposed_start": "2026-10-27T08:00:00Z",
    "timezone": "Europe/Paris",
    "technician_id": "USR-037",
    "approved_by": null,
    "notice": "未来预约提案，不是已发生事件，也不是已确认服务承诺。"
  },
  {
    "is_synthetic": true,
    "id": "VISIT-0403",
    "ticket_id": "WO-0403",
    "site_id": "SITE-067",
    "status": "pending_customer_confirmation",
    "proposed_start": "2026-10-27T08:00:00Z",
    "timezone": "Europe/Madrid",
    "technician_id": "USR-015",
    "approved_by": null,
    "notice": "未来预约提案，不是已发生事件，也不是已确认服务承诺。"
  },
  {
    "is_synthetic": true,
    "id": "VISIT-0412",
    "ticket_id": "WO-0412",
    "site_id": "SITE-064",
    "status": "pending_customer_confirmation",
    "proposed_start": "2026-10-27T08:00:00Z",
    "timezone": "Europe/Madrid",
    "technician_id": "USR-013",
    "approved_by": null,
    "notice": "未来预约提案，不是已发生事件，也不是已确认服务承诺。"
  },
  {
    "is_synthetic": true,
    "id": "VISIT-0439",
    "ticket_id": "WO-0439",
    "site_id": "SITE-087",
    "status": "pending_customer_confirmation",
    "proposed_start": "2026-10-27T08:00:00Z",
    "timezone": "Europe/London",
    "technician_id": "USR-021",
    "approved_by": null,
    "notice": "未来预约提案，不是已发生事件，也不是已确认服务承诺。"
  },
  {
    "is_synthetic": true,
    "id": "VISIT-0452",
    "ticket_id": "WO-0452",
    "site_id": "SITE-158",
    "status": "pending_customer_confirmation",
    "proposed_start": "2026-10-27T08:00:00Z",
    "timezone": "Europe/Paris",
    "technician_id": "USR-037",
    "approved_by": null,
    "notice": "未来预约提案，不是已发生事件，也不是已确认服务承诺。"
  },
  {
    "is_synthetic": true,
    "id": "VISIT-0466",
    "ticket_id": "WO-0466",
    "site_id": "SITE-080",
    "status": "pending_customer_confirmation",
    "proposed_start": "2026-10-27T08:00:00Z",
    "timezone": "Europe/London",
    "technician_id": "USR-019",
    "approved_by": null,
    "notice": "未来预约提案，不是已发生事件，也不是已确认服务承诺。"
  },
  {
    "is_synthetic": true,
    "id": "VISIT-0480",
    "ticket_id": "WO-0480",
    "site_id": "SITE-014",
    "status": "pending_customer_confirmation",
    "proposed_start": "2026-10-27T08:00:00Z",
    "timezone": "Europe/Berlin",
    "technician_id": "USR-001",
    "approved_by": null,
    "notice": "未来预约提案，不是已发生事件，也不是已确认服务承诺。"
  }
]
